admin2,indicator,choice,value,context,phase,Indicateur,label_choice,data_source_name,data_source_url,score,ch_label,label_choiceLabel
ziro,critical_handwashing_times,nsp,0,bfa_2020,NA,% de ménages par nombre de moments clés pour le lavage des mains que les personnes interrogées peuvent nommer,% de ménages par nombre de moments clés pour le lavage des mains que les personnes interrogées peuvent nommer_nsp,msna_2020,https://docs.google.com/spreadsheets/d/1nQS1xwC5Fligkydi04Oz2aX4xUeYuxEUQHFU4VEAj_M/edit?usp=sharing,NA,Je ne sais pas / préfère ne pas répondre,% de ménages par nombre de moments clés pour le lavage des mains que les personnes interrogées peuvent nommerJe ne sais pas / préfère ne pas répondre
ziro,critical_handwashing_times,autre,0,bfa_2020,NA,% de ménages par nombre de moments clés pour le lavage des mains que les personnes interrogées peuvent nommer,% de ménages par nombre de moments clés pour le lavage des mains que les personnes interrogées peuvent nommer_autre,msna_2020,https://docs.google.com/spreadsheets/d/1nQS1xwC5Fligkydi04Oz2aX4xUeYuxEUQHFU4VEAj_M/edit?usp=sharing,NA,Autres (à préciser),% de ménages par nombre de moments clés pour le lavage des mains que les personnes interrogées peuvent nommerAutres (à préciser)
ziro,critical_handwashing_times,ablution,0.5030631744432783,bfa_2020,NA,% de ménages par nombre de moments clés pour le lavage des mains que les personnes interrogées peuvent nommer,% de ménages par nombre de moments clés pour le lavage des mains que les personnes interrogées peuvent nommer_ablution,msna_2020,https://docs.google.com/spreadsheets/d/1nQS1xwC5Fligkydi04Oz2aX4xUeYuxEUQHFU4VEAj_M/edit?usp=sharing,NA,Ablution et/ou après manger,% de ménages par nombre de moments clés pour le lavage des mains que les personnes interrogées peuvent nommerAblution et/ou après manger
ziro,critical_handwashing_times,retour_champ,0.28583071041772956,bfa_2020,NA,% de ménages par nombre de moments clés pour le lavage des mains que les personnes interrogées peuvent nommer,% de ménages par nombre de moments clés pour le lavage des mains que les personnes interrogées peuvent nommer_retour_champ,msna_2020,https://docs.google.com/spreadsheets/d/1nQS1xwC5Fligkydi04Oz2aX4xUeYuxEUQHFU4VEAj_M/edit?usp=sharing,NA,Au retour des champs,% de ménages par nombre de moments clés pour le lavage des mains que les personnes interrogées peuvent nommerAu retour des champs
ziro,critical_handwashing_times,avant_sein,0,bfa_2020,NA,% de ménages par nombre de moments clés pour le lavage des mains que les personnes interrogées peuvent nommer,% de ménages par nombre de moments clés pour le lavage des mains que les personnes interrogées peuvent nommer_avant_sein,msna_2020,https://docs.google.com/spreadsheets/d/1nQS1xwC5Fligkydi04Oz2aX4xUeYuxEUQHFU4VEAj_M/edit?usp=sharing,NA,Avant de donner le sein à l’enfant,% de ménages par nombre de moments clés pour le lavage des mains que les personnes interrogées peuvent nommerAvant de donner le sein à l’enfant
ziro,critical_handwashing_times,apres_netto,0.03276753597445128,bfa_2020,NA,% de ménages par nombre de moments clés pour le lavage des mains que les personnes interrogées peuvent nommer,% de ménages par nombre de moments clés pour le lavage des mains que les personnes interrogées peuvent nommer_apres_netto,msna_2020,https://docs.google.com/spreadsheets/d/1nQS1xwC5Fligkydi04Oz2aX4xUeYuxEUQHFU4VEAj_M/edit?usp=sharing,after_changing,Après le nettoyage ou changement des couches de l’enfant,% de ménages par nombre de moments clés pour le lavage des mains que les personnes interrogées peuvent nommerAprès le nettoyage ou changement des couches de l’enfant
ziro,critical_handwashing_times,avant_prepare,0.12346841277836088,bfa_2020,NA,% de ménages par nombre de moments clés pour le lavage des mains que les personnes interrogées peuvent nommer,% de ménages par nombre de moments clés pour le lavage des mains que les personnes interrogées peuvent nommer_avant_prepare,msna_2020,https://docs.google.com/spreadsheets/d/1nQS1xwC5Fligkydi04Oz2aX4xUeYuxEUQHFU4VEAj_M/edit?usp=sharing,before_cooking,Avant de préparer les aliments,% de ménages par nombre de moments clés pour le lavage des mains que les personnes interrogées peuvent nommerAvant de préparer les aliments
ziro,critical_handwashing_times,avant_manger,1,bfa_2020,NA,% de ménages par nombre de moments clés pour le lavage des mains que les personnes interrogées peuvent nommer,% de ménages par nombre de moments clés pour le lavage des mains que les personnes interrogées peuvent nommer_avant_manger,msna_2020,https://docs.google.com/spreadsheets/d/1nQS1xwC5Fligkydi04Oz2aX4xUeYuxEUQHFU4VEAj_M/edit?usp=sharing,after_eat,Avant de manger,% de ménages par nombre de moments clés pour le lavage des mains que les personnes interrogées peuvent nommerAvant de manger
ziro,critical_handwashing_times,apres_toilette,0.4546495615980452,bfa_2020,NA,% de ménages par nombre de moments clés pour le lavage des mains que les personnes interrogées peuvent nommer,% de ménages par nombre de moments clés pour le lavage des mains que les personnes interrogées peuvent nommer_apres_toilette,msna_2020,https://docs.google.com/spreadsheets/d/1nQS1xwC5Fligkydi04Oz2aX4xUeYuxEUQHFU4VEAj_M/edit?usp=sharing,after_defec,Après la toilette ou la latrine,% de ménages par nombre de moments clés pour le lavage des mains que les personnes interrogées peuvent nommerAprès la toilette ou la latrine
ziro,critical_handwashing_times,aucun,0,bfa_2020,NA,% de ménages par nombre de moments clés pour le lavage des mains que les personnes interrogées peuvent nommer,% de ménages par nombre de moments clés pour le lavage des mains que les personnes interrogées peuvent nommer_aucun,msna_2020,https://docs.google.com/spreadsheets/d/1nQS1xwC5Fligkydi04Oz2aX4xUeYuxEUQHFU4VEAj_M/edit?usp=sharing,none,Aucun,% de ménages par nombre de moments clés pour le lavage des mains que les personnes interrogées peuvent nommerAucun
ziro,gbv_30days,NA,0,bfa_2020,NA,"% de ménages signalant l'incidence de la violence basée sur le genre (par exemple, violence sexuelle, mariage ou reproduction forcés, etc.) pour les femmes, les filles et les garçons dans leur communauté au cours des 30 derniers jours","% de ménages signalant l'incidence de la violence basée sur le genre (par exemple, violence sexuelle, mariage ou reproduction forcés, etc.) pour les femmes, les filles et les garçons dans leur communauté au cours des 30 derniers jours_NA",msna_2020,https://docs.google.com/spreadsheets/d/1nQS1xwC5Fligkydi04Oz2aX4xUeYuxEUQHFU4VEAj_M/edit?usp=sharing,NA,NA,"% de ménages signalant l'incidence de la violence basée sur le genre (par exemple, violence sexuelle, mariage ou reproduction forcés, etc.) pour les femmes, les filles et les garçons dans leur communauté au cours des 30 derniers joursNA"
ziro,access_to_soap,non,0.07811797437640608,bfa_2020,NA,% des ménages ayant accès au savon,% des ménages ayant accès au savon_non,msna_2020,https://docs.google.com/spreadsheets/d/1nQS1xwC5Fligkydi04Oz2aX4xUeYuxEUQHFU4VEAj_M/edit?usp=sharing,no_soap,Non,% des ménages ayant accès au savonNon
ziro,access_to_soap,oui,0.921882025623594,bfa_2020,NA,% des ménages ayant accès au savon,% des ménages ayant accès au savon_oui,msna_2020,https://docs.google.com/spreadsheets/d/1nQS1xwC5Fligkydi04Oz2aX4xUeYuxEUQHFU4VEAj_M/edit?usp=sharing,soap,Oui,% des ménages ayant accès au savonOui
ziro,type_handwashing_fac,bouilloire,0.6844649280510975,bfa_2020,NA,% de ménages ayant accès à des installations de lavage des mains en état de marche - par type d'appareil,% de ménages ayant accès à des installations de lavage des mains en état de marche - par type d'appareil_bouilloire,msna_2020,https://docs.google.com/spreadsheets/d/1nQS1xwC5Fligkydi04Oz2aX4xUeYuxEUQHFU4VEAj_M/edit?usp=sharing,NA,Bouilloire / arrosoir pour verser l'eau sur les mains,% de ménages ayant accès à des installations de lavage des mains en état de marche - par type d'appareilBouilloire / arrosoir pour verser l'eau sur les mains
ziro,type_handwashing_fac,pas_dispositif,0.31553507194890257,bfa_2020,NA,% de ménages ayant accès à des installations de lavage des mains en état de marche - par type d'appareil,% de ménages ayant accès à des installations de lavage des mains en état de marche - par type d'appareil_pas_dispositif,msna_2020,https://docs.google.com/spreadsheets/d/1nQS1xwC5Fligkydi04Oz2aX4xUeYuxEUQHFU4VEAj_M/edit?usp=sharing,NA,Pas de dispositif particulier (pas de dispositif ou juste un seau ou similaire sans robinet),% de ménages ayant accès à des installations de lavage des mains en état de marche - par type d'appareilPas de dispositif particulier (pas de dispositif ou juste un seau ou similaire sans robinet)
ziro,open_defecation,NA,0.6013657823666321,bfa_2020,NA,% de ménages pratiquant la défécation en plein air,% de ménages pratiquant la défécation en plein air_NA,msna_2020,https://docs.google.com/spreadsheets/d/1nQS1xwC5Fligkydi04Oz2aX4xUeYuxEUQHFU4VEAj_M/edit?usp=sharing,NA,NA,% de ménages pratiquant la défécation en plein airNA
ziro,sanitation_facility_sharing,ind,0.46274233342596205,bfa_2020,NA,% des ménages partageant une installation sanitaire - par nombre de personnes par installation sanitaire,% des ménages partageant une installation sanitaire - par nombre de personnes par installation sanitaire_ind,msna_2020,https://docs.google.com/spreadsheets/d/1nQS1xwC5Fligkydi04Oz2aX4xUeYuxEUQHFU4VEAj_M/edit?usp=sharing,not_shared,Individuelle,% des ménages partageant une installation sanitaire - par nombre de personnes par installation sanitaireIndividuelle
ziro,sanitation_facility_sharing,lat_com_20,0.4550581600465069,bfa_2020,NA,% des ménages partageant une installation sanitaire - par nombre de personnes par installation sanitaire,% des ménages partageant une installation sanitaire - par nombre de personnes par installation sanitaire_lat_com_20,msna_2020,https://docs.google.com/spreadsheets/d/1nQS1xwC5Fligkydi04Oz2aX4xUeYuxEUQHFU4VEAj_M/edit?usp=sharing,shared_less20,Latrine communautaire partagée par moins de 20 personnes,% des ménages partageant une installation sanitaire - par nombre de personnes par installation sanitaireLatrine communautaire partagée par moins de 20 personnes
ziro,sanitation_facility_sharing,lat_com_50,0.0821995065275311,bfa_2020,NA,% des ménages partageant une installation sanitaire - par nombre de personnes par installation sanitaire,% des ménages partageant une installation sanitaire - par nombre de personnes par installation sanitaire_lat_com_50,msna_2020,https://docs.google.com/spreadsheets/d/1nQS1xwC5Fligkydi04Oz2aX4xUeYuxEUQHFU4VEAj_M/edit?usp=sharing,shared_20to50,Latrine communautaire partagée entre 20 et 50 personnes,% des ménages partageant une installation sanitaire - par nombre de personnes par installation sanitaireLatrine communautaire partagée entre 20 et 50 personnes
ziro,location_sanitation_facility,dal_precis,0.03276753597445128,bfa_2020,NA,% de ménages selon l'emplacement des toilettes,% de ménages selon l'emplacement des toilettes_dal_precis,msna_2020,https://docs.google.com/spreadsheets/d/1nQS1xwC5Fligkydi04Oz2aX4xUeYuxEUQHFU4VEAj_M/edit?usp=sharing,NA,"Défécation à l'air libre (DAL) dans zone précise et aménagée (bâche, pelle, …)","% de ménages selon l'emplacement des toilettesDéfécation à l'air libre (DAL) dans zone précise et aménagée (bâche, pelle, …)"
ziro,location_sanitation_facility,dal_zonep,0.5560153439646773,bfa_2020,NA,% de ménages selon l'emplacement des toilettes,% de ménages selon l'emplacement des toilettes_dal_zonep,msna_2020,https://docs.google.com/spreadsheets/d/1nQS1xwC5Fligkydi04Oz2aX4xUeYuxEUQHFU4VEAj_M/edit?usp=sharing,NA,Défécation à l'air libre sans zone précise,% de ménages selon l'emplacement des toilettesDéfécation à l'air libre sans zone précise
ziro,location_sanitation_facility,dal_zonep_am,0.012582902427503524,bfa_2020,NA,% de ménages selon l'emplacement des toilettes,% de ménages selon l'emplacement des toilettes_dal_zonep_am,msna_2020,https://docs.google.com/spreadsheets/d/1nQS1xwC5Fligkydi04Oz2aX4xUeYuxEUQHFU4VEAj_M/edit?usp=sharing,NA,Défécation à l'air libre dans une zone précise non aménagée,% de ménages selon l'emplacement des toilettesDéfécation à l'air libre dans une zone précise non aménagée
ziro,location_sanitation_facility,lat_prive,0.2751658048550071,bfa_2020,NA,% de ménages selon l'emplacement des toilettes,% de ménages selon l'emplacement des toilettes_lat_prive,msna_2020,https://docs.google.com/spreadsheets/d/1nQS1xwC5Fligkydi04Oz2aX4xUeYuxEUQHFU4VEAj_M/edit?usp=sharing,NA,Latrine privée,% de ménages selon l'emplacement des toilettesLatrine privée
ziro,location_sanitation_facility,lat_publiq,0.12346841277836088,bfa_2020,NA,% de ménages selon l'emplacement des toilettes,% de ménages selon l'emplacement des toilettes_lat_publiq,msna_2020,https://docs.google.com/spreadsheets/d/1nQS1xwC5Fligkydi04Oz2aX4xUeYuxEUQHFU4VEAj_M/edit?usp=sharing,NA,Latrine publique,% de ménages selon l'emplacement des toilettesLatrine publique
ziro,type_of_sanitation_facility,dal,0.6013657823666321,bfa_2020,NA,% de ménages par type d'installation sanitaire,% de ménages par type d'installation sanitaire_dal,msna_2020,https://docs.google.com/spreadsheets/d/1nQS1xwC5Fligkydi04Oz2aX4xUeYuxEUQHFU4VEAj_M/edit?usp=sharing,open_defec,Défécation à l'air libre,% de ménages par type d'installation sanitaireDéfécation à l'air libre
ziro,type_of_sanitation_facility,lat_non,0.22981536645305226,bfa_2020,NA,% de ménages par type d'installation sanitaire,% de ménages par type d'installation sanitaire_lat_non,msna_2020,https://docs.google.com/spreadsheets/d/1nQS1xwC5Fligkydi04Oz2aX4xUeYuxEUQHFU4VEAj_M/edit?usp=sharing,latrine_nonhygienic,"Améliorée, non-hygiénique","% de ménages par type d'installation sanitaireAméliorée, non-hygiénique"
ziro,type_of_sanitation_facility,lat_oui,0.16881885118031567,bfa_2020,NA,% de ménages par type d'installation sanitaire,% de ménages par type d'installation sanitaire_lat_oui,msna_2020,https://docs.google.com/spreadsheets/d/1nQS1xwC5Fligkydi04Oz2aX4xUeYuxEUQHFU4VEAj_M/edit?usp=sharing,latrine_hygienic,"Améliorée, hygiénique","% de ménages par type d'installation sanitaireAméliorée, hygiénique"
ziro,prob_access_water,attente_longue,0.5709383272741166,bfa_2020,NA,% de ménages ayant des problèmes liés à l'accès à l'eau - par type de problèmes,% de ménages ayant des problèmes liés à l'accès à l'eau - par type de problèmes_attente_longue,msna_2020,https://docs.google.com/spreadsheets/d/1nQS1xwC5Fligkydi04Oz2aX4xUeYuxEUQHFU4VEAj_M/edit?usp=sharing,NA,L'attente est trop longue / nombre insuffisant de sources d’eau,% de ménages ayant des problèmes liés à l'accès à l'eau - par type de problèmesL'attente est trop longue / nombre insuffisant de sources d’eau
ziro,prob_access_water,distance_eau,0.3705265222197043,bfa_2020,NA,% de ménages ayant des problèmes liés à l'accès à l'eau - par type de problèmes,% de ménages ayant des problèmes liés à l'accès à l'eau - par type de problèmes_distance_eau,msna_2020,https://docs.google.com/spreadsheets/d/1nQS1xwC5Fligkydi04Oz2aX4xUeYuxEUQHFU4VEAj_M/edit?usp=sharing,NA,La distance au point d'eau est trop grande,% de ménages ayant des problèmes liés à l'accès à l'eau - par type de problèmesLa distance au point d'eau est trop grande
ziro,prob_access_water,qualite_eau,0.05853515050617906,bfa_2020,NA,% de ménages ayant des problèmes liés à l'accès à l'eau - par type de problèmes,% de ménages ayant des problèmes liés à l'accès à l'eau - par type de problèmes_qualite_eau,msna_2020,https://docs.google.com/spreadsheets/d/1nQS1xwC5Fligkydi04Oz2aX4xUeYuxEUQHFU4VEAj_M/edit?usp=sharing,NA,"La qualité de l’eau n’est pas bonne (l'eau est brunâtre, odorante ou salée)","% de ménages ayant des problèmes liés à l'accès à l'eau - par type de problèmesLa qualité de l’eau n’est pas bonne (l'eau est brunâtre, odorante ou salée)"
ziro,water_source,borne_fontaine,0.07811797437640608,bfa_2020,NA,% de ménages selon la qualité de la source d'eau,% de ménages selon la qualité de la source d'eau_borne_fontaine,msna_2020,https://docs.google.com/spreadsheets/d/1nQS1xwC5Fligkydi04Oz2aX4xUeYuxEUQHFU4VEAj_M/edit?usp=sharing,improved,Borne Fontaine,% de ménages selon la qualité de la source d'eauBorne Fontaine
ziro,water_source,pmh,0.7298153664530522,bfa_2020,NA,% de ménages selon la qualité de la source d'eau,% de ménages selon la qualité de la source d'eau_pmh,msna_2020,https://docs.google.com/spreadsheets/d/1nQS1xwC5Fligkydi04Oz2aX4xUeYuxEUQHFU4VEAj_M/edit?usp=sharing,improved,Forage avec une PMH (Pompe à Motricité Humaine),% de ménages selon la qualité de la source d'eauForage avec une PMH (Pompe à Motricité Humaine)
ziro,water_source,poste_auto,0.09830260792335382,bfa_2020,NA,% de ménages selon la qualité de la source d'eau,% de ménages selon la qualité de la source d'eau_poste_auto,msna_2020,https://docs.google.com/spreadsheets/d/1nQS1xwC5Fligkydi04Oz2aX4xUeYuxEUQHFU4VEAj_M/edit?usp=sharing,improved,Poste d'eau autonome (robinets publics),% de ménages selon la qualité de la source d'eauPoste d'eau autonome (robinets publics)
ziro,water_source,puit_tradi,0.09376405124718785,bfa_2020,NA,% de ménages selon la qualité de la source d'eau,% de ménages selon la qualité de la source d'eau_puit_tradi,msna_2020,https://docs.google.com/spreadsheets/d/1nQS1xwC5Fligkydi04Oz2aX4xUeYuxEUQHFU4VEAj_M/edit?usp=sharing,unimproved,Puits traditionnel / non protégé,% de ménages selon la qualité de la source d'eauPuits traditionnel / non protégé
ziro,sufficiency_of_water,insuffisant,0.3361623201277436,bfa_2020,NA,"% de ménages ayant accès à une quantité suffisante d'eau pour la boisson, la cuisine, l'hygiène corporelle, le nettoyage ou d'autres usages domestiques","% de ménages ayant accès à une quantité suffisante d'eau pour la boisson, la cuisine, l'hygiène corporelle, le nettoyage ou d'autres usages domestiques_insuffisant",msna_2020,https://docs.google.com/spreadsheets/d/1nQS1xwC5Fligkydi04Oz2aX4xUeYuxEUQHFU4VEAj_M/edit?usp=sharing,not_sufficient,Insuffisant,"% de ménages ayant accès à une quantité suffisante d'eau pour la boisson, la cuisine, l'hygiène corporelle, le nettoyage ou d'autres usages domestiquesInsuffisant"
ziro,sufficiency_of_water,juste_suffisant,0.14365304632530862,bfa_2020,NA,"% de ménages ayant accès à une quantité suffisante d'eau pour la boisson, la cuisine, l'hygiène corporelle, le nettoyage ou d'autres usages domestiques","% de ménages ayant accès à une quantité suffisante d'eau pour la boisson, la cuisine, l'hygiène corporelle, le nettoyage ou d'autres usages domestiques_juste_suffisant",msna_2020,https://docs.google.com/spreadsheets/d/1nQS1xwC5Fligkydi04Oz2aX4xUeYuxEUQHFU4VEAj_M/edit?usp=sharing,just_sufficient,Juste assez suffisant,"% de ménages ayant accès à une quantité suffisante d'eau pour la boisson, la cuisine, l'hygiène corporelle, le nettoyage ou d'autres usages domestiquesJuste assez suffisant"
ziro,sufficiency_of_water,pas_suffisant,0.09376405124718785,bfa_2020,NA,"% de ménages ayant accès à une quantité suffisante d'eau pour la boisson, la cuisine, l'hygiène corporelle, le nettoyage ou d'autres usages domestiques","% de ménages ayant accès à une quantité suffisante d'eau pour la boisson, la cuisine, l'hygiène corporelle, le nettoyage ou d'autres usages domestiques_pas_suffisant",msna_2020,https://docs.google.com/spreadsheets/d/1nQS1xwC5Fligkydi04Oz2aX4xUeYuxEUQHFU4VEAj_M/edit?usp=sharing,not_sufficient_at_all,Pas suffisant du tout,"% de ménages ayant accès à une quantité suffisante d'eau pour la boisson, la cuisine, l'hygiène corporelle, le nettoyage ou d'autres usages domestiquesPas suffisant du tout"
ziro,sufficiency_of_water,suffisant,0.42642058229975993,bfa_2020,NA,"% de ménages ayant accès à une quantité suffisante d'eau pour la boisson, la cuisine, l'hygiène corporelle, le nettoyage ou d'autres usages domestiques","% de ménages ayant accès à une quantité suffisante d'eau pour la boisson, la cuisine, l'hygiène corporelle, le nettoyage ou d'autres usages domestiques_suffisant",msna_2020,https://docs.google.com/spreadsheets/d/1nQS1xwC5Fligkydi04Oz2aX4xUeYuxEUQHFU4VEAj_M/edit?usp=sharing,sufficient,Suffisant,"% de ménages ayant accès à une quantité suffisante d'eau pour la boisson, la cuisine, l'hygiène corporelle, le nettoyage ou d'autres usages domestiquesSuffisant"
ziro,time_queing_water_source,entre_16_30mn,0.09830260792335382,bfa_2020,NA,% de ménages par temps (minutes) pris pour aller chercher de l'eau (attente et remplissage),% de ménages par temps (minutes) pris pour aller chercher de l'eau (attente et remplissage)_entre_16_30mn,msna_2020,https://docs.google.com/spreadsheets/d/1nQS1xwC5Fligkydi04Oz2aX4xUeYuxEUQHFU4VEAj_M/edit?usp=sharing,less_30,Entre 16 et 30 minutes,% de ménages par temps (minutes) pris pour aller chercher de l'eau (attente et remplissage)Entre 16 et 30 minutes
ziro,time_queing_water_source,entre_31_45mn,0.0453504384019548,bfa_2020,NA,% de ménages par temps (minutes) pris pour aller chercher de l'eau (attente et remplissage),% de ménages par temps (minutes) pris pour aller chercher de l'eau (attente et remplissage)_entre_31_45mn,msna_2020,https://docs.google.com/spreadsheets/d/1nQS1xwC5Fligkydi04Oz2aX4xUeYuxEUQHFU4VEAj_M/edit?usp=sharing,more_30,Entre 31 et 45 minutes,% de ménages par temps (minutes) pris pour aller chercher de l'eau (attente et remplissage)Entre 31 et 45 minutes
ziro,time_queing_water_source,entre_5_15mn,0.2751658048550071,bfa_2020,NA,% de ménages par temps (minutes) pris pour aller chercher de l'eau (attente et remplissage),% de ménages par temps (minutes) pris pour aller chercher de l'eau (attente et remplissage)_entre_5_15mn,msna_2020,https://docs.google.com/spreadsheets/d/1nQS1xwC5Fligkydi04Oz2aX4xUeYuxEUQHFU4VEAj_M/edit?usp=sharing,less_30,Entre 5 et 15 minutes,% de ménages par temps (minutes) pris pour aller chercher de l'eau (attente et remplissage)Entre 5 et 15 minutes
ziro,time_queing_water_source,moins_5mn,0.18900348472726344,bfa_2020,NA,% de ménages par temps (minutes) pris pour aller chercher de l'eau (attente et remplissage),% de ménages par temps (minutes) pris pour aller chercher de l'eau (attente et remplissage)_moins_5mn,msna_2020,https://docs.google.com/spreadsheets/d/1nQS1xwC5Fligkydi04Oz2aX4xUeYuxEUQHFU4VEAj_M/edit?usp=sharing,less_30,Moins de 5 minutes,% de ménages par temps (minutes) pris pour aller chercher de l'eau (attente et remplissage)Moins de 5 minutes
ziro,time_queing_water_source,plus_46mn,0.39217766409242094,bfa_2020,NA,% de ménages par temps (minutes) pris pour aller chercher de l'eau (attente et remplissage),% de ménages par temps (minutes) pris pour aller chercher de l'eau (attente et remplissage)_plus_46mn,msna_2020,https://docs.google.com/spreadsheets/d/1nQS1xwC5Fligkydi04Oz2aX4xUeYuxEUQHFU4VEAj_M/edit?usp=sharing,more_30,46 minutes ou plus,% de ménages par temps (minutes) pris pour aller chercher de l'eau (attente et remplissage)46 minutes ou plus
ziro,time_going_water_source,entre_16_30mn,0.1592991231960904,bfa_2020,NA,% de ménages par temps (minutes) pris pour aller chercher de l'eau (aller-retour à pied),% de ménages par temps (minutes) pris pour aller chercher de l'eau (aller-retour à pied)_entre_16_30mn,msna_2020,https://docs.google.com/spreadsheets/d/1nQS1xwC5Fligkydi04Oz2aX4xUeYuxEUQHFU4VEAj_M/edit?usp=sharing,less_30,Entre 16 et 30 minutes,% de ménages par temps (minutes) pris pour aller chercher de l'eau (aller-retour à pied)Entre 16 et 30 minutes
ziro,time_going_water_source,entre_31_45mn,0.06553507194890255,bfa_2020,NA,% de ménages par temps (minutes) pris pour aller chercher de l'eau (aller-retour à pied),% de ménages par temps (minutes) pris pour aller chercher de l'eau (aller-retour à pied)_entre_31_45mn,msna_2020,https://docs.google.com/spreadsheets/d/1nQS1xwC5Fligkydi04Oz2aX4xUeYuxEUQHFU4VEAj_M/edit?usp=sharing,more_30,Entre 31 et 45 minutes,% de ménages par temps (minutes) pris pour aller chercher de l'eau (aller-retour à pied)Entre 31 et 45 minutes
ziro,time_going_water_source,entre_5_15mn,0.20158638715476696,bfa_2020,NA,% de ménages par temps (minutes) pris pour aller chercher de l'eau (aller-retour à pied),% de ménages par temps (minutes) pris pour aller chercher de l'eau (aller-retour à pied)_entre_5_15mn,msna_2020,https://docs.google.com/spreadsheets/d/1nQS1xwC5Fligkydi04Oz2aX4xUeYuxEUQHFU4VEAj_M/edit?usp=sharing,less_30,Entre 5 et 15 minutes,% de ménages par temps (minutes) pris pour aller chercher de l'eau (aller-retour à pied)Entre 5 et 15 minutes
ziro,time_going_water_source,moins_5mn,0.24693682555672175,bfa_2020,NA,% de ménages par temps (minutes) pris pour aller chercher de l'eau (aller-retour à pied),% de ménages par temps (minutes) pris pour aller chercher de l'eau (aller-retour à pied)_moins_5mn,msna_2020,https://docs.google.com/spreadsheets/d/1nQS1xwC5Fligkydi04Oz2aX4xUeYuxEUQHFU4VEAj_M/edit?usp=sharing,less_30,Moins de 5 minutes,% de ménages par temps (minutes) pris pour aller chercher de l'eau (aller-retour à pied)Moins de 5 minutes
ziro,time_going_water_source,plus_46mn,0.3266425921435184,bfa_2020,NA,% de ménages par temps (minutes) pris pour aller chercher de l'eau (aller-retour à pied),% de ménages par temps (minutes) pris pour aller chercher de l'eau (aller-retour à pied)_plus_46mn,msna_2020,https://docs.google.com/spreadsheets/d/1nQS1xwC5Fligkydi04Oz2aX4xUeYuxEUQHFU4VEAj_M/edit?usp=sharing,more_30,46 minutes ou plus,% de ménages par temps (minutes) pris pour aller chercher de l'eau (aller-retour à pied)46 minutes ou plus
