admin2,indicator,choice,value,context,phase,Indicateur,label_choice,data_source_name,data_source_url,score,ch_label,label_choiceLabel
tapoa,critical_handwashing_times,nsp,0,bfa_2020,NA,% de ménages par nombre de moments clés pour le lavage des mains que les personnes interrogées peuvent nommer,% de ménages par nombre de moments clés pour le lavage des mains que les personnes interrogées peuvent nommer_nsp,msna_2020,https://docs.google.com/spreadsheets/d/1nQS1xwC5Fligkydi04Oz2aX4xUeYuxEUQHFU4VEAj_M/edit?usp=sharing,NA,Je ne sais pas / préfère ne pas répondre,% de ménages par nombre de moments clés pour le lavage des mains que les personnes interrogées peuvent nommerJe ne sais pas / préfère ne pas répondre
tapoa,critical_handwashing_times,autre,0,bfa_2020,NA,% de ménages par nombre de moments clés pour le lavage des mains que les personnes interrogées peuvent nommer,% de ménages par nombre de moments clés pour le lavage des mains que les personnes interrogées peuvent nommer_autre,msna_2020,https://docs.google.com/spreadsheets/d/1nQS1xwC5Fligkydi04Oz2aX4xUeYuxEUQHFU4VEAj_M/edit?usp=sharing,NA,Autres (à préciser),% de ménages par nombre de moments clés pour le lavage des mains que les personnes interrogées peuvent nommerAutres (à préciser)
tapoa,critical_handwashing_times,ablution,0.39432015643446244,bfa_2020,NA,% de ménages par nombre de moments clés pour le lavage des mains que les personnes interrogées peuvent nommer,% de ménages par nombre de moments clés pour le lavage des mains que les personnes interrogées peuvent nommer_ablution,msna_2020,https://docs.google.com/spreadsheets/d/1nQS1xwC5Fligkydi04Oz2aX4xUeYuxEUQHFU4VEAj_M/edit?usp=sharing,NA,Ablution et/ou après manger,% de ménages par nombre de moments clés pour le lavage des mains que les personnes interrogées peuvent nommerAblution et/ou après manger
tapoa,critical_handwashing_times,retour_champ,0.5000226723542872,bfa_2020,NA,% de ménages par nombre de moments clés pour le lavage des mains que les personnes interrogées peuvent nommer,% de ménages par nombre de moments clés pour le lavage des mains que les personnes interrogées peuvent nommer_retour_champ,msna_2020,https://docs.google.com/spreadsheets/d/1nQS1xwC5Fligkydi04Oz2aX4xUeYuxEUQHFU4VEAj_M/edit?usp=sharing,NA,Au retour des champs,% de ménages par nombre de moments clés pour le lavage des mains que les personnes interrogées peuvent nommerAu retour des champs
tapoa,critical_handwashing_times,avant_sein,0.08363369292513463,bfa_2020,NA,% de ménages par nombre de moments clés pour le lavage des mains que les personnes interrogées peuvent nommer,% de ménages par nombre de moments clés pour le lavage des mains que les personnes interrogées peuvent nommer_avant_sein,msna_2020,https://docs.google.com/spreadsheets/d/1nQS1xwC5Fligkydi04Oz2aX4xUeYuxEUQHFU4VEAj_M/edit?usp=sharing,NA,Avant de donner le sein à l’enfant,% de ménages par nombre de moments clés pour le lavage des mains que les personnes interrogées peuvent nommerAvant de donner le sein à l’enfant
tapoa,critical_handwashing_times,apres_netto,0.0690085730251702,bfa_2020,NA,% de ménages par nombre de moments clés pour le lavage des mains que les personnes interrogées peuvent nommer,% de ménages par nombre de moments clés pour le lavage des mains que les personnes interrogées peuvent nommer_apres_netto,msna_2020,https://docs.google.com/spreadsheets/d/1nQS1xwC5Fligkydi04Oz2aX4xUeYuxEUQHFU4VEAj_M/edit?usp=sharing,after_changing,Après le nettoyage ou changement des couches de l’enfant,% de ménages par nombre de moments clés pour le lavage des mains que les personnes interrogées peuvent nommerAprès le nettoyage ou changement des couches de l’enfant
tapoa,critical_handwashing_times,avant_prepare,0.35795855280220856,bfa_2020,NA,% de ménages par nombre de moments clés pour le lavage des mains que les personnes interrogées peuvent nommer,% de ménages par nombre de moments clés pour le lavage des mains que les personnes interrogées peuvent nommer_avant_prepare,msna_2020,https://docs.google.com/spreadsheets/d/1nQS1xwC5Fligkydi04Oz2aX4xUeYuxEUQHFU4VEAj_M/edit?usp=sharing,before_cooking,Avant de préparer les aliments,% de ménages par nombre de moments clés pour le lavage des mains que les personnes interrogées peuvent nommerAvant de préparer les aliments
tapoa,critical_handwashing_times,avant_manger,0.9937859993425475,bfa_2020,NA,% de ménages par nombre de moments clés pour le lavage des mains que les personnes interrogées peuvent nommer,% de ménages par nombre de moments clés pour le lavage des mains que les personnes interrogées peuvent nommer_avant_manger,msna_2020,https://docs.google.com/spreadsheets/d/1nQS1xwC5Fligkydi04Oz2aX4xUeYuxEUQHFU4VEAj_M/edit?usp=sharing,after_eat,Avant de manger,% de ménages par nombre de moments clés pour le lavage des mains que les personnes interrogées peuvent nommerAvant de manger
tapoa,critical_handwashing_times,apres_toilette,0.4838883933664365,bfa_2020,NA,% de ménages par nombre de moments clés pour le lavage des mains que les personnes interrogées peuvent nommer,% de ménages par nombre de moments clés pour le lavage des mains que les personnes interrogées peuvent nommer_apres_toilette,msna_2020,https://docs.google.com/spreadsheets/d/1nQS1xwC5Fligkydi04Oz2aX4xUeYuxEUQHFU4VEAj_M/edit?usp=sharing,after_defec,Après la toilette ou la latrine,% de ménages par nombre de moments clés pour le lavage des mains que les personnes interrogées peuvent nommerAprès la toilette ou la latrine
tapoa,critical_handwashing_times,aucun,0,bfa_2020,NA,% de ménages par nombre de moments clés pour le lavage des mains que les personnes interrogées peuvent nommer,% de ménages par nombre de moments clés pour le lavage des mains que les personnes interrogées peuvent nommer_aucun,msna_2020,https://docs.google.com/spreadsheets/d/1nQS1xwC5Fligkydi04Oz2aX4xUeYuxEUQHFU4VEAj_M/edit?usp=sharing,none,Aucun,% de ménages par nombre de moments clés pour le lavage des mains que les personnes interrogées peuvent nommerAucun
tapoa,gbv_30days,NA,0.17702778320974086,bfa_2020,NA,"% de ménages signalant l'incidence de la violence basée sur le genre (par exemple, violence sexuelle, mariage ou reproduction forcés, etc.) pour les femmes, les filles et les garçons dans leur communauté au cours des 30 derniers jours","% de ménages signalant l'incidence de la violence basée sur le genre (par exemple, violence sexuelle, mariage ou reproduction forcés, etc.) pour les femmes, les filles et les garçons dans leur communauté au cours des 30 derniers jours_NA",msna_2020,https://docs.google.com/spreadsheets/d/1nQS1xwC5Fligkydi04Oz2aX4xUeYuxEUQHFU4VEAj_M/edit?usp=sharing,NA,NA,"% de ménages signalant l'incidence de la violence basée sur le genre (par exemple, violence sexuelle, mariage ou reproduction forcés, etc.) pour les femmes, les filles et les garçons dans leur communauté au cours des 30 derniers joursNA"
tapoa,access_to_soap,non,0.44883693552963605,bfa_2020,NA,% des ménages ayant accès au savon,% des ménages ayant accès au savon_non,msna_2020,https://docs.google.com/spreadsheets/d/1nQS1xwC5Fligkydi04Oz2aX4xUeYuxEUQHFU4VEAj_M/edit?usp=sharing,no_soap,Non,% des ménages ayant accès au savonNon
tapoa,access_to_soap,nsp,2.487724485678383e-5,bfa_2020,NA,% des ménages ayant accès au savon,% des ménages ayant accès au savon_nsp,msna_2020,https://docs.google.com/spreadsheets/d/1nQS1xwC5Fligkydi04Oz2aX4xUeYuxEUQHFU4VEAj_M/edit?usp=sharing,NA,NA,% des ménages ayant accès au savonNA
tapoa,access_to_soap,oui,0.5511381872255072,bfa_2020,NA,% des ménages ayant accès au savon,% des ménages ayant accès au savon_oui,msna_2020,https://docs.google.com/spreadsheets/d/1nQS1xwC5Fligkydi04Oz2aX4xUeYuxEUQHFU4VEAj_M/edit?usp=sharing,soap,Oui,% des ménages ayant accès au savonOui
tapoa,type_handwashing_fac,bouilloire,0.5894760757792502,bfa_2020,NA,% de ménages ayant accès à des installations de lavage des mains en état de marche - par type d'appareil,% de ménages ayant accès à des installations de lavage des mains en état de marche - par type d'appareil_bouilloire,msna_2020,https://docs.google.com/spreadsheets/d/1nQS1xwC5Fligkydi04Oz2aX4xUeYuxEUQHFU4VEAj_M/edit?usp=sharing,NA,Bouilloire / arrosoir pour verser l'eau sur les mains,% de ménages ayant accès à des installations de lavage des mains en état de marche - par type d'appareilBouilloire / arrosoir pour verser l'eau sur les mains
tapoa,type_handwashing_fac,pas_dispositif,0.3808110042832259,bfa_2020,NA,% de ménages ayant accès à des installations de lavage des mains en état de marche - par type d'appareil,% de ménages ayant accès à des installations de lavage des mains en état de marche - par type d'appareil_pas_dispositif,msna_2020,https://docs.google.com/spreadsheets/d/1nQS1xwC5Fligkydi04Oz2aX4xUeYuxEUQHFU4VEAj_M/edit?usp=sharing,NA,Pas de dispositif particulier (pas de dispositif ou juste un seau ou similaire sans robinet),% de ménages ayant accès à des installations de lavage des mains en état de marche - par type d'appareilPas de dispositif particulier (pas de dispositif ou juste un seau ou similaire sans robinet)
tapoa,type_handwashing_fac,seau_rob,0.010158125110733746,bfa_2020,NA,% de ménages ayant accès à des installations de lavage des mains en état de marche - par type d'appareil,% de ménages ayant accès à des installations de lavage des mains en état de marche - par type d'appareil_seau_rob,msna_2020,https://docs.google.com/spreadsheets/d/1nQS1xwC5Fligkydi04Oz2aX4xUeYuxEUQHFU4VEAj_M/edit?usp=sharing,NA,Seau avec robinet,% de ménages ayant accès à des installations de lavage des mains en état de marche - par type d'appareilSeau avec robinet
tapoa,type_handwashing_fac,tippy,0.019554794826790203,bfa_2020,NA,% de ménages ayant accès à des installations de lavage des mains en état de marche - par type d'appareil,% de ménages ayant accès à des installations de lavage des mains en état de marche - par type d'appareil_tippy,msna_2020,https://docs.google.com/spreadsheets/d/1nQS1xwC5Fligkydi04Oz2aX4xUeYuxEUQHFU4VEAj_M/edit?usp=sharing,NA,"Tippy tap (dispostif artisanal fabriqué avec du matériel local : poutre, seau et système de levier avec une corde)","% de ménages ayant accès à des installations de lavage des mains en état de marche - par type d'appareilTippy tap (dispostif artisanal fabriqué avec du matériel local : poutre, seau et système de levier avec une corde)"
tapoa,open_defecation,NA,0.5786072428013798,bfa_2020,NA,% de ménages pratiquant la défécation en plein air,% de ménages pratiquant la défécation en plein air_NA,msna_2020,https://docs.google.com/spreadsheets/d/1nQS1xwC5Fligkydi04Oz2aX4xUeYuxEUQHFU4VEAj_M/edit?usp=sharing,NA,NA,% de ménages pratiquant la défécation en plein airNA
tapoa,sanitation_facility_sharing,ind,0.5234397684119233,bfa_2020,NA,% des ménages partageant une installation sanitaire - par nombre de personnes par installation sanitaire,% des ménages partageant une installation sanitaire - par nombre de personnes par installation sanitaire_ind,msna_2020,https://docs.google.com/spreadsheets/d/1nQS1xwC5Fligkydi04Oz2aX4xUeYuxEUQHFU4VEAj_M/edit?usp=sharing,not_shared,Individuelle,% des ménages partageant une installation sanitaire - par nombre de personnes par installation sanitaireIndividuelle
tapoa,sanitation_facility_sharing,lat_com_20,0.4552998656615303,bfa_2020,NA,% des ménages partageant une installation sanitaire - par nombre de personnes par installation sanitaire,% des ménages partageant une installation sanitaire - par nombre de personnes par installation sanitaire_lat_com_20,msna_2020,https://docs.google.com/spreadsheets/d/1nQS1xwC5Fligkydi04Oz2aX4xUeYuxEUQHFU4VEAj_M/edit?usp=sharing,shared_less20,Latrine communautaire partagée par moins de 20 personnes,% des ménages partageant une installation sanitaire - par nombre de personnes par installation sanitaireLatrine communautaire partagée par moins de 20 personnes
tapoa,sanitation_facility_sharing,lat_com_50,0.02126036592654644,bfa_2020,NA,% des ménages partageant une installation sanitaire - par nombre de personnes par installation sanitaire,% des ménages partageant une installation sanitaire - par nombre de personnes par installation sanitaire_lat_com_50,msna_2020,https://docs.google.com/spreadsheets/d/1nQS1xwC5Fligkydi04Oz2aX4xUeYuxEUQHFU4VEAj_M/edit?usp=sharing,shared_20to50,Latrine communautaire partagée entre 20 et 50 personnes,% des ménages partageant une installation sanitaire - par nombre de personnes par installation sanitaireLatrine communautaire partagée entre 20 et 50 personnes
tapoa,location_sanitation_facility,dal_eau,0.03395471815488674,bfa_2020,NA,% de ménages selon l'emplacement des toilettes,% de ménages selon l'emplacement des toilettes_dal_eau,msna_2020,https://docs.google.com/spreadsheets/d/1nQS1xwC5Fligkydi04Oz2aX4xUeYuxEUQHFU4VEAj_M/edit?usp=sharing,NA,Défécation à l'air libre dans un cours d’eau,% de ménages selon l'emplacement des toilettesDéfécation à l'air libre dans un cours d’eau
tapoa,location_sanitation_facility,dal_precis,0.006189123412595711,bfa_2020,NA,% de ménages selon l'emplacement des toilettes,% de ménages selon l'emplacement des toilettes_dal_precis,msna_2020,https://docs.google.com/spreadsheets/d/1nQS1xwC5Fligkydi04Oz2aX4xUeYuxEUQHFU4VEAj_M/edit?usp=sharing,NA,"Défécation à l'air libre (DAL) dans zone précise et aménagée (bâche, pelle, …)","% de ménages selon l'emplacement des toilettesDéfécation à l'air libre (DAL) dans zone précise et aménagée (bâche, pelle, …)"
tapoa,location_sanitation_facility,dal_zonep,0.520067445827052,bfa_2020,NA,% de ménages selon l'emplacement des toilettes,% de ménages selon l'emplacement des toilettes_dal_zonep,msna_2020,https://docs.google.com/spreadsheets/d/1nQS1xwC5Fligkydi04Oz2aX4xUeYuxEUQHFU4VEAj_M/edit?usp=sharing,NA,Défécation à l'air libre sans zone précise,% de ménages selon l'emplacement des toilettesDéfécation à l'air libre sans zone précise
tapoa,location_sanitation_facility,dal_zonep_am,0.018395955406845365,bfa_2020,NA,% de ménages selon l'emplacement des toilettes,% de ménages selon l'emplacement des toilettes_dal_zonep_am,msna_2020,https://docs.google.com/spreadsheets/d/1nQS1xwC5Fligkydi04Oz2aX4xUeYuxEUQHFU4VEAj_M/edit?usp=sharing,NA,Défécation à l'air libre dans une zone précise non aménagée,% de ménages selon l'emplacement des toilettesDéfécation à l'air libre dans une zone précise non aménagée
tapoa,location_sanitation_facility,lat_prive,0.2933556599799595,bfa_2020,NA,% de ménages selon l'emplacement des toilettes,% de ménages selon l'emplacement des toilettes_lat_prive,msna_2020,https://docs.google.com/spreadsheets/d/1nQS1xwC5Fligkydi04Oz2aX4xUeYuxEUQHFU4VEAj_M/edit?usp=sharing,NA,Latrine privée,% de ménages selon l'emplacement des toilettesLatrine privée
tapoa,location_sanitation_facility,lat_privep,0.128012219973804,bfa_2020,NA,% de ménages selon l'emplacement des toilettes,% de ménages selon l'emplacement des toilettes_lat_privep,msna_2020,https://docs.google.com/spreadsheets/d/1nQS1xwC5Fligkydi04Oz2aX4xUeYuxEUQHFU4VEAj_M/edit?usp=sharing,NA,Latrine privée partagée,% de ménages selon l'emplacement des toilettesLatrine privée partagée
tapoa,location_sanitation_facility,lat_publiq,2.487724485678383e-5,bfa_2020,NA,% de ménages selon l'emplacement des toilettes,% de ménages selon l'emplacement des toilettes_lat_publiq,msna_2020,https://docs.google.com/spreadsheets/d/1nQS1xwC5Fligkydi04Oz2aX4xUeYuxEUQHFU4VEAj_M/edit?usp=sharing,NA,Latrine publique,% de ménages selon l'emplacement des toilettesLatrine publique
tapoa,type_of_sanitation_facility,dal,0.5786072428013798,bfa_2020,NA,% de ménages par type d'installation sanitaire,% de ménages par type d'installation sanitaire_dal,msna_2020,https://docs.google.com/spreadsheets/d/1nQS1xwC5Fligkydi04Oz2aX4xUeYuxEUQHFU4VEAj_M/edit?usp=sharing,open_defec,Défécation à l'air libre,% de ménages par type d'installation sanitaireDéfécation à l'air libre
tapoa,type_of_sanitation_facility,lat_non,0.17674660809396484,bfa_2020,NA,% de ménages par type d'installation sanitaire,% de ménages par type d'installation sanitaire_lat_non,msna_2020,https://docs.google.com/spreadsheets/d/1nQS1xwC5Fligkydi04Oz2aX4xUeYuxEUQHFU4VEAj_M/edit?usp=sharing,latrine_nonhygienic,"Améliorée, non-hygiénique","% de ménages par type d'installation sanitaireAméliorée, non-hygiénique"
tapoa,type_of_sanitation_facility,lat_oui,0.24464614910465543,bfa_2020,NA,% de ménages par type d'installation sanitaire,% de ménages par type d'installation sanitaire_lat_oui,msna_2020,https://docs.google.com/spreadsheets/d/1nQS1xwC5Fligkydi04Oz2aX4xUeYuxEUQHFU4VEAj_M/edit?usp=sharing,latrine_hygienic,"Améliorée, hygiénique","% de ménages par type d'installation sanitaireAméliorée, hygiénique"
tapoa,prob_access_water,attente_longue,0.6256036623969752,bfa_2020,NA,% de ménages ayant des problèmes liés à l'accès à l'eau - par type de problèmes,% de ménages ayant des problèmes liés à l'accès à l'eau - par type de problèmes_attente_longue,msna_2020,https://docs.google.com/spreadsheets/d/1nQS1xwC5Fligkydi04Oz2aX4xUeYuxEUQHFU4VEAj_M/edit?usp=sharing,NA,L'attente est trop longue / nombre insuffisant de sources d’eau,% de ménages ayant des problèmes liés à l'accès à l'eau - par type de problèmesL'attente est trop longue / nombre insuffisant de sources d’eau
tapoa,prob_access_water,distance_eau,0.10239274552959762,bfa_2020,NA,% de ménages ayant des problèmes liés à l'accès à l'eau - par type de problèmes,% de ménages ayant des problèmes liés à l'accès à l'eau - par type de problèmes_distance_eau,msna_2020,https://docs.google.com/spreadsheets/d/1nQS1xwC5Fligkydi04Oz2aX4xUeYuxEUQHFU4VEAj_M/edit?usp=sharing,NA,La distance au point d'eau est trop grande,% de ménages ayant des problèmes liés à l'accès à l'eau - par type de problèmesLa distance au point d'eau est trop grande
tapoa,prob_access_water,manque_finance,0.033695117478300916,bfa_2020,NA,% de ménages ayant des problèmes liés à l'accès à l'eau - par type de problèmes,% de ménages ayant des problèmes liés à l'accès à l'eau - par type de problèmes_manque_finance,msna_2020,https://docs.google.com/spreadsheets/d/1nQS1xwC5Fligkydi04Oz2aX4xUeYuxEUQHFU4VEAj_M/edit?usp=sharing,NA,Pas de moyens financiers / l’eau est trop cher,% de ménages ayant des problèmes liés à l'accès à l'eau - par type de problèmesPas de moyens financiers / l’eau est trop cher
tapoa,prob_access_water,manque_recipien,0.06655151914271822,bfa_2020,NA,% de ménages ayant des problèmes liés à l'accès à l'eau - par type de problèmes,% de ménages ayant des problèmes liés à l'accès à l'eau - par type de problèmes_manque_recipien,msna_2020,https://docs.google.com/spreadsheets/d/1nQS1xwC5Fligkydi04Oz2aX4xUeYuxEUQHFU4VEAj_M/edit?usp=sharing,NA,Pas assez de récipients pour stocker l’eau,% de ménages ayant des problèmes liés à l'accès à l'eau - par type de problèmesPas assez de récipients pour stocker l’eau
tapoa,prob_access_water,pas_resc_eau,0.06171616875924833,bfa_2020,NA,% de ménages ayant des problèmes liés à l'accès à l'eau - par type de problèmes,% de ménages ayant des problèmes liés à l'accès à l'eau - par type de problèmes_pas_resc_eau,msna_2020,https://docs.google.com/spreadsheets/d/1nQS1xwC5Fligkydi04Oz2aX4xUeYuxEUQHFU4VEAj_M/edit?usp=sharing,NA,Pas de ressources en eau,% de ménages ayant des problèmes liés à l'accès à l'eau - par type de problèmesPas de ressources en eau
tapoa,prob_access_water,qualite_eau,0.03662057445720714,bfa_2020,NA,% de ménages ayant des problèmes liés à l'accès à l'eau - par type de problèmes,% de ménages ayant des problèmes liés à l'accès à l'eau - par type de problèmes_qualite_eau,msna_2020,https://docs.google.com/spreadsheets/d/1nQS1xwC5Fligkydi04Oz2aX4xUeYuxEUQHFU4VEAj_M/edit?usp=sharing,NA,"La qualité de l’eau n’est pas bonne (l'eau est brunâtre, odorante ou salée)","% de ménages ayant des problèmes liés à l'accès à l'eau - par type de problèmesLa qualité de l’eau n’est pas bonne (l'eau est brunâtre, odorante ou salée)"
tapoa,prob_access_water,srce_ferme,0.07342021223595267,bfa_2020,NA,% de ménages ayant des problèmes liés à l'accès à l'eau - par type de problèmes,% de ménages ayant des problèmes liés à l'accès à l'eau - par type de problèmes_srce_ferme,msna_2020,https://docs.google.com/spreadsheets/d/1nQS1xwC5Fligkydi04Oz2aX4xUeYuxEUQHFU4VEAj_M/edit?usp=sharing,NA,La source d’eau ne fonctionne pas / est fermée,% de ménages ayant des problèmes liés à l'accès à l'eau - par type de problèmesLa source d’eau ne fonctionne pas / est fermée
tapoa,water_source,borne_fontaine,0.015479546181789438,bfa_2020,NA,% de ménages selon la qualité de la source d'eau,% de ménages selon la qualité de la source d'eau_borne_fontaine,msna_2020,https://docs.google.com/spreadsheets/d/1nQS1xwC5Fligkydi04Oz2aX4xUeYuxEUQHFU4VEAj_M/edit?usp=sharing,improved,Borne Fontaine,% de ménages selon la qualité de la source d'eauBorne Fontaine
tapoa,water_source,cours_eau,0.008958964216839003,bfa_2020,NA,% de ménages selon la qualité de la source d'eau,% de ménages selon la qualité de la source d'eau_cours_eau,msna_2020,https://docs.google.com/spreadsheets/d/1nQS1xwC5Fligkydi04Oz2aX4xUeYuxEUQHFU4VEAj_M/edit?usp=sharing,surface_water,"Cours d'eau (fleuve, rivière, ruisseau, eau de surface, etc.)","% de ménages selon la qualité de la source d'eauCours d'eau (fleuve, rivière, ruisseau, eau de surface, etc.)"
tapoa,water_source,eau _robi_conce,0.012200608221907201,bfa_2020,NA,% de ménages selon la qualité de la source d'eau,% de ménages selon la qualité de la source d'eau_eau _robi_conce,msna_2020,https://docs.google.com/spreadsheets/d/1nQS1xwC5Fligkydi04Oz2aX4xUeYuxEUQHFU4VEAj_M/edit?usp=sharing,improved,Eau du robinet dans concession,% de ménages selon la qualité de la source d'eauEau du robinet dans concession
tapoa,water_source,non_amenage,0.015221885747278728,bfa_2020,NA,% de ménages selon la qualité de la source d'eau,% de ménages selon la qualité de la source d'eau_non_amenage,msna_2020,https://docs.google.com/spreadsheets/d/1nQS1xwC5Fligkydi04Oz2aX4xUeYuxEUQHFU4VEAj_M/edit?usp=sharing,unimproved,Source non aménagée,% de ménages selon la qualité de la source d'eauSource non aménagée
tapoa,water_source,pmh,0.6730006039725865,bfa_2020,NA,% de ménages selon la qualité de la source d'eau,% de ménages selon la qualité de la source d'eau_pmh,msna_2020,https://docs.google.com/spreadsheets/d/1nQS1xwC5Fligkydi04Oz2aX4xUeYuxEUQHFU4VEAj_M/edit?usp=sharing,improved,Forage avec une PMH (Pompe à Motricité Humaine),% de ménages selon la qualité de la source d'eauForage avec une PMH (Pompe à Motricité Humaine)
tapoa,water_source,poste_auto,0.0657391451129219,bfa_2020,NA,% de ménages selon la qualité de la source d'eau,% de ménages selon la qualité de la source d'eau_poste_auto,msna_2020,https://docs.google.com/spreadsheets/d/1nQS1xwC5Fligkydi04Oz2aX4xUeYuxEUQHFU4VEAj_M/edit?usp=sharing,improved,Poste d'eau autonome (robinets publics),% de ménages selon la qualité de la source d'eauPoste d'eau autonome (robinets publics)
tapoa,water_source,puit_protege,0.08498011414028597,bfa_2020,NA,% de ménages selon la qualité de la source d'eau,% de ménages selon la qualité de la source d'eau_puit_protege,msna_2020,https://docs.google.com/spreadsheets/d/1nQS1xwC5Fligkydi04Oz2aX4xUeYuxEUQHFU4VEAj_M/edit?usp=sharing,improved,Puits aménagé / protégé,% de ménages selon la qualité de la source d'eauPuits aménagé / protégé
tapoa,water_source,puit_tradi,0.12279210204887848,bfa_2020,NA,% de ménages selon la qualité de la source d'eau,% de ménages selon la qualité de la source d'eau_puit_tradi,msna_2020,https://docs.google.com/spreadsheets/d/1nQS1xwC5Fligkydi04Oz2aX4xUeYuxEUQHFU4VEAj_M/edit?usp=sharing,unimproved,Puits traditionnel / non protégé,% de ménages selon la qualité de la source d'eauPuits traditionnel / non protégé
tapoa,water_source,source_amenage,0.001627030357512727,bfa_2020,NA,% de ménages selon la qualité de la source d'eau,% de ménages selon la qualité de la source d'eau_source_amenage,msna_2020,https://docs.google.com/spreadsheets/d/1nQS1xwC5Fligkydi04Oz2aX4xUeYuxEUQHFU4VEAj_M/edit?usp=sharing,improved,Source aménagée,% de ménages selon la qualité de la source d'eauSource aménagée
tapoa,sufficiency_of_water,insuffisant,0.3925740327752307,bfa_2020,NA,"% de ménages ayant accès à une quantité suffisante d'eau pour la boisson, la cuisine, l'hygiène corporelle, le nettoyage ou d'autres usages domestiques","% de ménages ayant accès à une quantité suffisante d'eau pour la boisson, la cuisine, l'hygiène corporelle, le nettoyage ou d'autres usages domestiques_insuffisant",msna_2020,https://docs.google.com/spreadsheets/d/1nQS1xwC5Fligkydi04Oz2aX4xUeYuxEUQHFU4VEAj_M/edit?usp=sharing,not_sufficient,Insuffisant,"% de ménages ayant accès à une quantité suffisante d'eau pour la boisson, la cuisine, l'hygiène corporelle, le nettoyage ou d'autres usages domestiquesInsuffisant"
